{
  "$schema": "https://json-schema.org/draft/2020-12/schema",
  "$id": "https://workline.dev/schemas/design/design-baseline.v1.schema.json",
  "title": "Workline UI Design Package v1 — baseline",
  "description": "Immutable authority of one published revision: the closed selection of normative files with their revision and the SHA-256 of their bytes, sealed by a digest over canonical JSON WITHOUT the digest field. The mutable manifest, the governance records and the regenerable projections are excluded by construction, so re-indexing or re-rendering can never alter a revision published months ago.",
  "type": "object",
  "additionalProperties": false,
  "required": [
    "schema",
    "package",
    "revision",
    "parent_baseline",
    "published",
    "digest",
    "selection"
  ],
  "properties": {
    "schema": {
      "const": "workline.design-baseline/v1"
    },
    "package": {
      "type": "string",
      "pattern": "^DES-(?:[0-9]{3}|[1-9][0-9]{3,})$"
    },
    "revision": {
      "type": "integer",
      "minimum": 1
    },
    "parent_baseline": {
      "description": "The previous revision of THIS package, or null for the first. A line never forks: an intentional divergence creates another package with `derived_from`.",
      "type": ["string", "null"],
      "pattern": "^DES-(?:[0-9]{3}|[1-9][0-9]{3,})@r[1-9][0-9]{0,5}$"
    },
    "published": {
      "type": "string",
      "pattern": "^[0-9]{4}-[0-9]{2}-[0-9]{2}$"
    },
    "digest": {
      "description": "SHA-256 over canonical JSON of this document WITHOUT this field. No self-reference, so anyone can recompute and compare.",
      "type": "string",
      "pattern": "^sha256:[0-9a-f]{64}$"
    },
    "selection": {
      "description": "The closed set of normative files this revision publishes together. Never empty: a published revision publishes something.",
      "type": "array",
      "items": {
        "type": "object",
        "additionalProperties": false,
        "required": ["path", "revision", "sha256"],
        "properties": {
          "path": {
            "description": "Package-relative path under flows/, screens/, design-system/rules/, tokens/, renditions/ or assets/.",
            "type": "string",
            "minLength": 1
          },
          "revision": {
            "description": "The revision the file's own name carries; null for a content-addressed asset.",
            "type": ["integer", "null"],
            "minimum": 1
          },
          "sha256": {
            "description": "Digest of the file's BYTES, not of a projection of them.",
            "type": "string",
            "pattern": "^sha256:[0-9a-f]{64}$"
          }
        }
      },
      "minItems": 1
    }
  }
}
